image_id, description, label
485, Crazy things you can do with a lil' fake blood and one leg, creepy
710, My leg after I got second degree burns for a gas can exploding., gore
2261, My cousin knows I haven't had much luck with things lately so she mailed me a few things to brighten up my day. It made me cry like a little kid., happy
3032, New at my work, "Indie" hair products, hashtag denotes firmness of product., rage
364, I came home for lunch today and now I'm never going to sleep again, creepy
